{
  "$schema": "https://raw.githubusercontent.com/patrick-tarly-co/trust-center/main/availability-status-v1.schema.json",
  "provider": "Pincus Technologies Inc",
  "service": "Tarly Cowork",
  "fedRampPackageId": "FR2628650874",
  "generated_at": "2026-10-22T00:30:23.311640Z",
  "current_status": "operational",
  "services": [
    {
      "name": "cowork-trust",
      "url": "https://gov.tarly.co/trust/",
      "operational": true,
      "http_status": 200,
      "latency_ms": 83,
      "content_check": "text-markers",
      "content_verified": true
    },
    {
      "name": "cowork-web",
      "url": "https://gov.tarly.co/health",
      "operational": true,
      "http_status": 200,
      "latency_ms": 246,
      "content_check": "json-field",
      "content_verified": true
    }
  ],
  "history_window_days": 30,
  "observed_days": 30,
  "expected_days_since_monitoring_started": 30,
  "history_complete": true,
  "daily_history": [
    {
      "checked_at": "2026-09-23T15:37:01.599658Z",
      "fedRampPackageId": "FR2628650874",
      "sample_sha256": "86b0ab355d8c37ae1b9d0e97decfd9067e22f87236a3aa1951282b33507ca74b",
      "services": [
        {
          "content_check": "text-markers",
          "content_verified": true,
          "http_status": 200,
          "latency_ms": 109,
          "name": "cowork-trust",
          "operational": true,
          "url": "https://gov.tarly.co/trust/"
        },
        {
          "content_check": "json-field",
          "content_verified": true,
          "http_status": 200,
          "latency_ms": 210,
          "name": "cowork-web",
          "operational": true,
          "url": "https://gov.tarly.co/health"
        }
      ],
      "status": "operational"
    },
    {
      "checked_at": "2026-09-24T16:48:22.657889Z",
      "fedRampPackageId": "FR2628650874",
      "sample_sha256": "87a3d76c592f4e234fc28dbe77edf3777270bc0f56026068f5edc4fdff20df2f",
      "services": [
        {
          "content_check": "text-markers",
          "content_verified": true,
          "http_status": 200,
          "latency_ms": 76,
          "name": "cowork-trust",
          "operational": true,
          "url": "https://gov.tarly.co/trust/"
        },
        {
          "content_check": "json-field",
          "content_verified": true,
          "http_status": 200,
          "latency_ms": 236,
          "name": "cowork-web",
          "operational": true,
          "url": "https://gov.tarly.co/health"
        }
      ],
      "status": "operational"
    },
    {
      "checked_at": "2026-09-25T07:18:59.642738Z",
      "fedRampPackageId": "FR2628650874",
      "sample_sha256": "0165a3a268b6f51eb3c79e1ca5250d5b0a2f74cd91e65211821f8cc9d574ca74",
      "services": [
        {
          "content_check": "text-markers",
          "content_verified": true,
          "http_status": 200,
          "latency_ms": 77,
          "name": "cowork-trust",
          "operational": true,
          "url": "https://gov.tarly.co/trust/"
        },
        {
          "content_check": "json-field",
          "content_verified": true,
          "http_status": 200,
          "latency_ms": 241,
          "name": "cowork-web",
          "operational": true,
          "url": "https://gov.tarly.co/health"
        }
      ],
      "status": "operational"
    },
    {
      "checked_at": "2026-09-26T07:17:23.234610Z",
      "fedRampPackageId": "FR2628650874",
      "sample_sha256": "093af7161542240f0481132af4b698423d39bbe76e4f274c0d0a80a0a3a2fdc3",
      "services": [
        {
          "content_check": "text-markers",
          "content_verified": true,
          "http_status": 200,
          "latency_ms": 131,
          "name": "cowork-trust",
          "operational": true,
          "url": "https://gov.tarly.co/trust/"
        },
        {
          "content_check": "json-field",
          "content_verified": true,
          "http_status": 200,
          "latency_ms": 206,
          "name": "cowork-web",
          "operational": true,
          "url": "https://gov.tarly.co/health"
        }
      ],
      "status": "operational"
    },
    {
      "checked_at": "2026-09-27T07:17:06.508203Z",
      "fedRampPackageId": "FR2628650874",
      "sample_sha256": "7b67ccab94951d79f924ab387ee480ca729cd7af6b27737fe96aba6b517144d1",
      "services": [
        {
          "content_check": "text-markers",
          "content_verified": true,
          "http_status": 200,
          "latency_ms": 71,
          "name": "cowork-trust",
          "operational": true,
          "url": "https://gov.tarly.co/trust/"
        },
        {
          "content_check": "json-field",
          "content_verified": true,
          "http_status": 200,
          "latency_ms": 246,
          "name": "cowork-web",
          "operational": true,
          "url": "https://gov.tarly.co/health"
        }
      ],
      "status": "operational"
    },
    {
      "checked_at": "2026-09-28T07:16:48.544857Z",
      "fedRampPackageId": "FR2628650874",
      "sample_sha256": "6ce6e773a8fec4dccdaad134c1686d4e55125983bf23f7855a98ba541a20a317",
      "services": [
        {
          "content_check": "text-markers",
          "content_verified": true,
          "http_status": 200,
          "latency_ms": 364,
          "name": "cowork-trust",
          "operational": true,
          "url": "https://gov.tarly.co/trust/"
        },
        {
          "content_check": "json-field",
          "content_verified": true,
          "http_status": 200,
          "latency_ms": 254,
          "name": "cowork-web",
          "operational": true,
          "url": "https://gov.tarly.co/health"
        }
      ],
      "status": "operational"
    },
    {
      "checked_at": "2026-09-29T20:25:04.088997Z",
      "fedRampPackageId": "FR2628650874",
      "sample_sha256": "180ddd2774c47def24bd4e25fa2e26797f66d6c130fba01c44160f2f5d28c750",
      "services": [
        {
          "content_check": "text-markers",
          "content_verified": true,
          "http_status": 200,
          "latency_ms": 87,
          "name": "cowork-trust",
          "operational": true,
          "url": "https://gov.tarly.co/trust/"
        },
        {
          "content_check": "json-field",
          "content_verified": true,
          "http_status": 200,
          "latency_ms": 179,
          "name": "cowork-web",
          "operational": true,
          "url": "https://gov.tarly.co/health"
        }
      ],
      "status": "operational"
    },
    {
      "checked_at": "2026-09-30T07:18:11.318155Z",
      "fedRampPackageId": "FR2628650874",
      "sample_sha256": "2e6fed57d749ecfa81b166afa953db67c01ded223ded434ccd5d1a9904681a18",
      "services": [
        {
          "content_check": "text-markers",
          "content_verified": true,
          "http_status": 200,
          "latency_ms": 122,
          "name": "cowork-trust",
          "operational": true,
          "url": "https://gov.tarly.co/trust/"
        },
        {
          "content_check": "json-field",
          "content_verified": true,
          "http_status": 200,
          "latency_ms": 312,
          "name": "cowork-web",
          "operational": true,
          "url": "https://gov.tarly.co/health"
        }
      ],
      "status": "operational"
    },
    {
      "checked_at": "2026-10-01T14:00:52.278854Z",
      "fedRampPackageId": "FR2628650874",
      "sample_sha256": "89f7d77c7825fe7f2b7b26415e74fc2ecb94516b5f4820e7e8e93f1c6a58a105",
      "services": [
        {
          "content_check": "text-markers",
          "content_verified": true,
          "http_status": 200,
          "latency_ms": 129,
          "name": "cowork-trust",
          "operational": true,
          "url": "https://gov.tarly.co/trust/"
        },
        {
          "content_check": "json-field",
          "content_verified": true,
          "http_status": 200,
          "latency_ms": 255,
          "name": "cowork-web",
          "operational": true,
          "url": "https://gov.tarly.co/health"
        }
      ],
      "status": "operational"
    },
    {
      "checked_at": "2026-10-02T13:37:37.067532Z",
      "fedRampPackageId": "FR2628650874",
      "sample_sha256": "919b0cbb306ad966bfce585a204db95fb89622a3bf19bd276a48dc5290d07d51",
      "services": [
        {
          "content_check": "text-markers",
          "content_verified": true,
          "http_status": 200,
          "latency_ms": 104,
          "name": "cowork-trust",
          "operational": true,
          "url": "https://gov.tarly.co/trust/"
        },
        {
          "content_check": "json-field",
          "content_verified": true,
          "http_status": 200,
          "latency_ms": 332,
          "name": "cowork-web",
          "operational": true,
          "url": "https://gov.tarly.co/health"
        }
      ],
      "status": "operational"
    },
    {
      "checked_at": "2026-10-03T07:18:02.090582Z",
      "fedRampPackageId": "FR2628650874",
      "sample_sha256": "d216883f222bbdc9ea9ed55cb234a3f5006fb1d2bcccd06047304bdd071260c9",
      "services": [
        {
          "content_check": "text-markers",
          "content_verified": true,
          "http_status": 200,
          "latency_ms": 74,
          "name": "cowork-trust",
          "operational": true,
          "url": "https://gov.tarly.co/trust/"
        },
        {
          "content_check": "json-field",
          "content_verified": true,
          "http_status": 200,
          "latency_ms": 272,
          "name": "cowork-web",
          "operational": true,
          "url": "https://gov.tarly.co/health"
        }
      ],
      "status": "operational"
    },
    {
      "checked_at": "2026-10-04T07:16:49.255072Z",
      "fedRampPackageId": "FR2628650874",
      "sample_sha256": "1326ffb7cec3884309032017c43d1b4eacdc4a6370b0b6017498f72e504939cf",
      "services": [
        {
          "content_check": "text-markers",
          "content_verified": true,
          "http_status": 200,